{"$schema":"https://json-schema.org/draft/2020-12/schema","type":"object","required":["schema_version","authority","ecosystem","systems","paths"],"properties":{"schema_version":{"type":"string"},"authority":{"const":"tsic"},"ecosystem":{"const":"tinlance"},"systems":{"type":"array","minItems":1},"paths":{"type":"object"}}}