{
  "$schema": "../../schemas/canonical-architecture.schema.json",
  "schema_version": "2.0.0",
  "authority": "tsic",
  "ecosystem": "tinlance",
  "systems": [
    {
      "id": "tsic",
      "layer": "integration",
      "authority": [
        "ecosystem_integration_contracts",
        "ecosystem_registry",
        "compatibility_policy",
        "conformance_requirements",
        "certification_evidence"
      ]
    },
    {
      "id": "agent-platform",
      "layer": "agent",
      "authority": [
        "identity",
        "authorization",
        "policy",
        "runtime",
        "tools",
        "mcp",
        "sandbox",
        "secrets",
        "budgets",
        "evidence",
        "audit",
        "observability",
        "external_content_publishing"
      ]
    },
    {
      "id": "agent-platform-sdk",
      "layer": "agent",
      "authority": [
        "developer_sdk_surface"
      ]
    },
    {
      "id": "agent-os",
      "layer": "agent",
      "authority": [
        "workspace",
        "environment",
        "lifecycle",
        "orchestration",
        "ux",
        "builder",
        "fleet"
      ]
    },
    {
      "id": "agent-developer",
      "layer": "agent",
      "authority": [
        "agent_development_surface"
      ]
    },
    {
      "id": "world-intelligence",
      "layer": "intelligence",
      "authority": [
        "world_intelligence"
      ]
    },
    {
      "id": "web-intelligence",
      "repository": "LloydCoder/tinlance-web-intelligence",
      "governance_role": "web_intelligence_acquisition_authority",
      "authority": [
        "web_search_and_fetch",
        "browser_capture",
        "source_evidence_acquisition",
        "source_change_monitoring"
      ]
    },
    {
      "id": "tads",
      "layer": "acquisition",
      "authority": [
        "acquisition_targeting"
      ]
    },
    {
      "id": "sdea",
      "layer": "acquisition",
      "authority": [
        "engineering_acquisition_signals"
      ]
    },
    {
      "id": "reconos",
      "layer": "intelligence",
      "authority": [
        "osint_fusion"
      ]
    },
    {
      "id": "fadereach",
      "layer": "acquisition",
      "authority": [
        "outreach_execution"
      ]
    },
    {
      "id": "fas",
      "layer": "evidence",
      "authority": [
        "evidence_first_analysis"
      ]
    },
    {
      "id": "fas-bench",
      "layer": "evaluation",
      "authority": [
        "benchmark_corpus",
        "evaluation_harness",
        "regression_evaluation",
        "reproducibility_evidence"
      ]
    },
    {
      "id": "fdse",
      "layer": "delivery",
      "authority": [
        "engineering_delivery",
        "transformation_delivery"
      ]
    },
    {
      "id": "fde-mastery",
      "layer": "delivery",
      "authority": [
        "fde_methodology",
        "domain_execution",
        "engagement_delivery"
      ]
    },
    {
      "id": "fde",
      "layer": "delivery",
      "authority": [
        "domain_engineering"
      ]
    },
    {
      "id": "transformation",
      "layer": "delivery",
      "authority": [
        "portfolio_transformation",
        "replication"
      ]
    },
    {
      "id": "fdse-toolkit",
      "layer": "delivery",
      "authority": [
        "delivery_reporting"
      ]
    },
    {
      "id": "threatfade",
      "layer": "product",
      "authority": [
        "threat_detection_response"
      ]
    },
    {
      "id": "threatfade-web",
      "layer": "product",
      "authority": [
        "product_presentation",
        "analyst_workflow",
        "research_surface",
        "commercial_workflow"
      ]
    },
    {
      "id": "bugflow",
      "layer": "product",
      "authority": [
        "application_security_testing"
      ]
    },
    {
      "id": "hezqara",
      "layer": "product",
      "authority": [
        "healthcare_governed_ai_workforce"
      ]
    },
    {
      "id": "economic-attribution",
      "layer": "economics",
      "authority": [
        "economic_attribution"
      ]
    },
    {
      "id": "tinlance-com",
      "layer": "commercial",
      "authority": [
        "commercial_offers",
        "aaas_catalog",
        "buyer_experience",
        "entitlement_presentation"
      ]
    },
    {
      "id": "hezcast",
      "layer": "content",
      "authority": [
        "content_generation",
        "content_package_generation",
        "content_quality_validation"
      ]
    },
    {
      "id": "hezcast-saas",
      "layer": "product",
      "authority": [
        "content_product_experience"
      ]
    },
    {
      "id": "aurontra",
      "layer": "product",
      "authority": [
        "it_resilience_product"
      ]
    }
  ],
  "paths": {
    "engineering": [
      "world-intelligence",
      "tads",
      "sdea",
      "reconos",
      "fadereach",
      "fdse",
      "fde-mastery"
    ],
    "transformation": [
      "world-intelligence",
      "tads",
      "transformation",
      "fdse",
      "fde-mastery"
    ],
    "agent": [
      "agent-developer",
      "agent-os",
      "agent-platform-sdk",
      "agent-platform"
    ],
    "evaluation": [
      "fas",
      "fas-bench"
    ],
    "security": [
      "threatfade",
      "threatfade-web",
      "fas"
    ],
    "delivery": [
      "fdse",
      "fde-mastery",
      "fdse-toolkit"
    ],
    "commercial": [
      "tinlance-com",
      "tads",
      "sdea",
      "reconos",
      "fadereach",
      "agent-platform",
      "fdse",
      "fdse-toolkit",
      "economic-attribution"
    ],
    "revenue": [
      "world-intelligence",
      "tads",
      "sdea",
      "reconos",
      "fadereach",
      "agent-platform",
      "fdse",
      "economic-attribution",
      "fas-bench"
    ],
    "content-generation": [
      "hezcast",
      "agent-platform"
    ]
  }
}
